{
  "contribution_id": "meta_export_1757826465",
  "contributor": {
    "email": "suite_base_1757826465@example.com",
    "wallet_address": "0x832ee95dd9683379698b4c86d2ee5ef1ba3f4ed4",
    "name": "Test User",
    "locale": "en"
  },
  "data": {
    "platform": "instagram",
    "source_type": "meta_export",
    "extraction_method": "google_drive_api",
    "profile": {
      "username": "test_user",
      "display_name": "TU",
      "email": "suite_base_1757826465@example.com",
      "account_type": "Public",
      "phone_confirmed": false,
      "private_account": false
    },
    "metrics": {
      "posts_count": 0,
      "following_count": 0,
      "follower_count": 0,
      "likes_given_count": 0,
      "comments_count": 280,
      "account_age_days": 1000,
      "total_interactions": 0,
      "has_story_activity": false
    },
    "activities": {
      "following_list": [],
      "likes_given": [],
      "posts_created": [],
      "comments_made": []
    },
    "security": {
      "last_login": 1757826465,
      "contact_syncing": false,
      "has_shared_live_video": false
    },
    "raw_export_data": {
      "personal_information": {
        "content": {
          "profile_user": [
            {
              "title": "Kullan\u00c4\u00b1c\u00c4\u00b1 Bilgileri",
              "media_map_data": {
                "Profil Foto\u00c4\u009fraf\u00c4\u00b1": {
                  "uri": "media/profile/202505/491450907_18494292448058830_5836859394600162289_n_17858254968411576.jpg",
                  "creation_timestamp": 1746103658,
                  "media_metadata": {
                    "camera_metadata": {
                      "has_camera_metadata": false
                    }
                  },
                  "title": "",
                  "cross_post_source": {
                    "source_app": "FB"
                  }
                }
              },
              "string_map_data": {
                "E-posta": {
                  "href": "",
                  "value": "aygulelatas@gmail.com",
                  "timestamp": 0
                },
                "Telefon Numaras\u00c4\u00b1": {
                  "href": "",
                  "value": "+905068946052",
                  "timestamp": 0
                },
                "Telefon Onayland\u00c4\u00b1": {
                  "href": "",
                  "value": "False",
                  "timestamp": 0
                },
                "Telefon Onay\u00c4\u00b1 Y\u00c3\u00b6ntemi": {
                  "href": "",
                  "value": "Unconfirmed",
                  "timestamp": 0
                },
                "Kullan\u00c4\u00b1c\u00c4\u00b1 ad\u00c4\u00b1": {
                  "href": "",
                  "value": "dr.ayglelts",
                  "timestamp": 0
                },
                "Ad": {
                  "href": "",
                  "value": "dr.ayglelts",
                  "timestamp": 0
                },
                "Biyografi": {
                  "href": "",
                  "value": "Pediatrician & Web3Dev",
                  "timestamp": 0
                },
                "Cinsiyet": {
                  "href": "",
                  "value": "female",
                  "timestamp": 0
                },
                "Do\u00c4\u009fum tarihi": {
                  "href": "",
                  "value": "1994-05-04",
                  "timestamp": 0
                },
                "Gizli Hesap": {
                  "href": "",
                  "value": "True",
                  "timestamp": 0
                },
                "Emoji Pong Y\u00c3\u00bcksek Puan\u00c4\u00b1": {
                  "href": "",
                  "value": "0",
                  "timestamp": 0
                }
              }
            }
          ]
        }
      },
      "profile_information": {
        "content": {
          "profile_account_insights": [
            {
              "title": "",
              "media_map_data": {},
              "string_map_data": {
                "Rehber Senkronizasyonu": {
                  "href": "",
                  "value": "True",
                  "timestamp": 0
                },
                "\u00c4\u00b0lk \u00c3\u009clke Kodu": {
                  "href": "",
                  "value": "TR",
                  "timestamp": 0
                },
                "Canl\u00c4\u00b1 Video Payla\u00c5\u009ft\u00c4\u00b1": {
                  "href": "",
                  "value": "True",
                  "timestamp": 0
                },
                "Son Giri\u00c5\u009f": {
                  "href": "",
                  "value": "",
                  "timestamp": 1744478510
                },
                "Son \u00c3\u0087\u00c4\u00b1k\u00c4\u00b1\u00c5\u009f": {
                  "href": "",
                  "value": "",
                  "timestamp": 1739215582
                },
                "\u00c4\u00b0lk Hikaye Zaman\u00c4\u00b1": {
                  "href": "",
                  "value": "",
                  "timestamp": 1500556809
                },
                "Son Hikaye Zaman\u00c4\u00b1": {
                  "href": "",
                  "value": "",
                  "timestamp": 1746288691
                },
                "\u00c4\u00b0lk Yak\u00c4\u00b1n Arkada\u00c5\u009flar Hikayesi Zaman\u00c4\u00b1": {
                  "href": "",
                  "value": "",
                  "timestamp": 0
                }
              }
            }
          ]
        }
      }
    }
  },
  "metadata": {
    "version": "1.0.0",
    "schema_version": "vana_datadao_v1",
    "source": "Instagram Meta Export",
    "collection_date": "2025-09-14T08:07:45",
    "data_type": "instagram_meta_export",
    "processing_timestamp": 1757826465,
    "extraction_completeness": 85.0,
    "folder_structure": {
      "metaFolderId": "meta",
      "instagramFolderId": "ig",
      "instagramFolderName": "ig-folder"
    },
    "privacy_settings": {
      "contains_pii": true,
      "anonymization_level": "partial",
      "retention_policy": "user_controlled"
    },
    "quality_score": 90.0,
    "data_freshness": 75.0
  },
  "created_at": "2025-09-14T08:07:45",
  "updated_at": "2025-09-14T08:07:45"
}