{
  "contribution_id": "meta_export_004",
  "contributor": {
    "wallet_address": "0x5555555555555555555555555555555555555555",
    "email": "manipulated@vdatadao.com",
    "name": "Manipulated Data User",
    "locale": "en"
  },
  "data": {
    "platform": "instagram",
    "source_type": "meta_export",
    "extraction_method": "google_drive_api",
    "profile": {
      "username": "manipulated_user",
      "display_name": "Manipulated Data User",
      "email": "manipulated@vdatadao.com",
      "account_type": "Public",
      "date_of_birth": "1988-12-10",
      "phone_confirmed": true,
      "private_account": false
    },
    "metrics": {
      "posts_count": 200,
      "following_count": 2000,
      "follower_count": 5000,
      "likes_given_count": 10000,
      "comments_count": 500,
      "account_age_days": 2000,
      "total_interactions": 10500,
      "has_story_activity": true
    },
    "activities": {
      "following_list": [
        {
          "username": "friend6",
          "followed_at": 1600000000
        }
      ],
      "likes_given": [
        {
          "target_username": "friend6",
          "count": 50,
          "last_activity": 1600003000
        }
      ],
      "posts_created": [
        {
          "creation_timestamp": 1600000000,
          "title": "Very old post from 2020",
          "source_app": "instagram",
          "has_photo": true,
          "has_camera_metadata": true
        }
      ],
      "comments_made": []
    },
    "security": {
      "last_login": 1600005000,
      "contact_syncing": true,
      "has_shared_live_video": false
    },
    "raw_export_data": {
      "profile_data": {
        "content": "manipulated_user_encrypted_profile_data_with_sufficient_content_to_pass_validation_requirements_for_vdatadao_testing_purposes_this_represents_a_user_with_manipulated_timestamps_to_test_fraud_detection_mechanisms_in_the_proof_system_this_data_has_been_artificially_aged_with_old_timestamps_from_2020_to_test_whether_the_system_can_detect_temporal_manipulation_attempts_and_prevents_fraudulent_contributions_while_maintaining_data_integrity_and_security_standards_required_by_the_vana_datadao_platform",
        "size": 2000
      },
      "posts_data": {
        "content": "manipulated_user_encrypted_posts_data_with_sufficient_content_to_pass_validation_requirements_for_vdatadao_testing_purposes_this_represents_user_posts_with_manipulated_timestamps_to_test_fraud_detection_mechanisms_in_the_proof_system_this_data_has_been_artificially_aged_with_old_timestamps_from_2020_to_test_whether_the_system_can_detect_temporal_manipulation_attempts_and_prevents_fraudulent_contributions_while_maintaining_data_integrity_and_security_standards_required_by_the_vana_datadao_platform",
        "size": 3000
      },
      "stories_data": {
        "content": "manipulated_user_encrypted_stories_data_with_sufficient_content_to_pass_validation_requirements_for_vdatadao_testing_purposes_this_represents_user_stories_with_manipulated_timestamps_to_test_fraud_detection_mechanisms_in_the_proof_system_this_data_has_been_artificially_aged_with_old_timestamps_from_2020_to_test_whether_the_system_can_detect_temporal_manipulation_attempts_and_prevents_fraudulent_contributions_while_maintaining_data_integrity_and_security_standards_required_by_the_vana_datadao_platform",
        "size": 1500
      },
      "messages_data": {
        "content": "manipulated_user_encrypted_messages_data_with_sufficient_content_to_pass_validation_requirements_for_vdatadao_testing_purposes_this_represents_user_messages_with_manipulated_timestamps_to_test_fraud_detection_mechanisms_in_the_proof_system_this_data_has_been_artificially_aged_with_old_timestamps_from_2020_to_test_whether_the_system_can_detect_temporal_manipulation_attempts_and_prevents_fraudulent_contributions_while_maintaining_data_integrity_and_security_standards_required_by_the_vana_datadao_platform",
        "size": 2500
      }
    }
  },
  "metadata": {
    "version": "1.0.0",
    "schema_version": "vana_datadao_v1",
    "source": "manipulated_data_test",
    "collection_date": "2024-01-04T00:00:00Z",
    "data_type": "instagram_meta_export",
    "processing_timestamp": 1704326400,
    "extraction_completeness": 95.0,
    "folder_structure": {
      "metaFolderId": "test_meta_folder_4",
      "instagramFolderId": "test_instagram_folder_4",
      "instagramFolderName": "Instagram Data 4"
    },
    "privacy_settings": {
      "contains_pii": true,
      "anonymization_level": "partial",
      "retention_policy": "user_controlled"
    },
    "quality_score": 90.0,
    "data_freshness": 60.0
  },
  "created_at": "2024-01-04T00:00:00Z",
  "updated_at": "2024-01-04T00:00:00Z"
}