{
  "contribution_id": "meta_export_1757826465",
  "contributor": {
    "email": "suite_base_1757826465@example.com",
    "wallet_address": "0x3e9de3b09a2c57f8a67183052efa255becbc42c1",
    "name": "Test User",
    "locale": "en"
  },
  "data": {
    "platform": "instagram",
    "source_type": "meta_export",
    "extraction_method": "google_drive_api",
    "profile": {
      "username": "test_user",
      "display_name": "TU",
      "email": "suite_base_1757826465@example.com",
      "account_type": "Public",
      "phone_confirmed": false,
      "private_account": false
    },
    "metrics": {
      "posts_count": 0,
      "following_count": 0,
      "follower_count": 0,
      "likes_given_count": 0,
      "comments_count": 280,
      "account_age_days": 1000,
      "total_interactions": 0,
      "has_story_activity": false
    },
    "activities": {
      "following_list": [],
      "likes_given": [],
      "posts_created": [],
      "comments_made": []
    },
    "security": {
      "last_login": 1757826465,
      "contact_syncing": false,
      "has_shared_live_video": false
    },
    "raw_export_data": {
      "personal_information": {
        "content": {
          "x": 1
        }
      },
      "profile_information": {
        "content": {
          "y": 2
        }
      }
    }
  },
  "metadata": {
    "version": "1.0.0",
    "schema_version": "vana_datadao_v1",
    "source": "Instagram Meta Export",
    "collection_date": "2025-09-14T08:07:45",
    "data_type": "instagram_meta_export",
    "processing_timestamp": 1757826465,
    "extraction_completeness": 85.0,
    "folder_structure": {
      "metaFolderId": "meta",
      "instagramFolderId": "ig",
      "instagramFolderName": "ig-folder"
    },
    "privacy_settings": {
      "contains_pii": true,
      "anonymization_level": "partial",
      "retention_policy": "user_controlled"
    },
    "quality_score": 90.0,
    "data_freshness": 75.0
  },
  "created_at": "2025-09-14T08:07:45",
  "updated_at": "2025-09-14T08:07:45"
}